Job_Title,Company,Location,Summary,Salary
"Accountant
new",WSD Consultant,,"Knowledge of Accountancy, Computer, Accounting Software, MS Office.
Producing error-free accounting reports and present results to Management.","₹1,00,000 - ₹5,00,000 a year"
"Accountant
new",Marg Hospitality,,"Prepare, examine and analyze accounting records, financial statements, and other financial reports to assess accuracy, completeness, and conformance to report…",
"Senior Accountant
new",Flaviant Network Private Limited,,"Proven experience as a accounting supervisor or senior accountant .
*Guide junior accountants and other staff by answering questions and coordinating…","₹4,80,000 - ₹5,40,000 a year"
"Finance Executive
new",S.S.Opal Solutions,,"Immediate recruitment on finance executive.
Good communication skill on English language.
Job Types: Fresher, Walk-In.
Total work: 1 year (Preferred).","₹15,000 - ₹20,000 a month"
Accountant,Trident Precision,,"We are looking for an accountant who can:
We are a trading firm based out of IMT Manesar.
Update Bank and completely maintain company accounts.","₹25,000 - ₹32,000 a month"
"Associate Director
new",Deloitte,,"Audit is about much more than just the numbers.
It’s about attesting to accomplishments and challenges, and helping to assure strong foundations for future…",
"Junior Accountant
new",Fairmont Holidays Inn Limited,,"Support Accounts payable team by working closely with onshore partner, performing indexing of invoices on daily basis or vouchers in database management system.","₹20,000 a month"
"Finance Accountant
new",ansrsource,,"This will be on a contract basis.*.
The candidate will need to have an in-depth knowledge of finance and account.
Part-time hours: 40-45 per week.",
Accountant,Infosys BPM Limited,,"Coordination with vendor for vendor queries;
Should have the ability to work under pressure, multi task and meet the targets within defined timelines.",
"Senior Accountant
new",Barhonia Engicon Pvt Ltd,,"Looking for an experience candidate to start a permanent position at our company head office in Patna, Bihar.
Job Types: Full-time, Contract.","₹40,000 - ₹55,000 a month"
"ACCOUNTS OFFICER
new",TORTEK INDIA PRIVATE LIMITED,,"Applicant should be well versed with the accounts and balance sheets finalization.
Candidate should have good knowledge of GST and TDS and should be able to…","₹3,00,000 - ₹3,60,000 a year"
"Accountant Cashier Back Office Clerk Computer Operator
new",Jitendra Kumar Kuswaha (Proprietor Of Nexus Job Ca...,,"Greetings from the select group.
Hiring Company: HDFC, AXIS,ICICI,Kotak Mahindra etc.
Handel Passenger Queries and address customer grievance.","₹25,000 - ₹65,000 a month"
"Accountant
new",AJ Career,,"Processing & Reconciling Bank statement and Credit card statement and comparing with past transactions for consistency.
Recording year end Journal entries.","₹4,40,000 a year"
"accountant
new",AMS Digital,,"Salary: ₹9,847.00 - ₹25,555.00 per month.
Total work: 1 year (Required).","₹9,847 - ₹25,555 a month"
General Ledger Accountant,Optiva,,The General Ledger Accountant will work with local accountants in individual countries to ensure compliance with sales taxes (GST / VAT) and financial reporting…,
General Ledger Accountant,Optiva,,The General Ledger Accountant will work with local accountants in individual countries to ensure compliance with sales taxes (GST / VAT) and financial reporting…,
"Accountant
new",SAC Management India Pvt Ltd,,"Min 2 yrs exp in accounts basic education - b com.
Salary: Up to ₹15,000.00 per month.
Total work: 1 year (Preferred).","₹15,000 a month"
"BCG_CoreAssurance_Consultant
new",EY,,"Freshers qualified chartered accountants are also eligible to apply.
EY is a global leader in assurance, tax, transaction and advisory services.",
"Sr. Accountant
new",Raja Bahadur International Ltd.,,"The key roles and responsibilities are as follows: -.
5 years of experience, preferably in company using Ind-AS accounting norms and/or in real estate sector.","₹50,000 a month"
"Senior Accountant
new",Arban Dairy,,"Senior accountant capable of handling complete account books of the private limited company independently until trial balance.
Freshers, please do not apply.","₹12,133 - ₹30,013 a month"
"Sr. Accountant/ UK accounts
new",CKRACCOUNATANTS UK,,"We are a UK based MNC firm having its backend office in Zirakpur.
The candidate has a direct responsibility for maintaining general ledger accounts, preparing…","₹25,000 - ₹40,000 a month"
"Accountant cum Data Entry Operator
new",Citizens Foundation,,"Excellent computer skills with excellent typing skills.
Has a duty of receiving and reconciling all invoices.
Producing timely and accurate financial statements…","₹9,500 - ₹10,500 a month"
"Accountant
new",Client of Umind Consulting,,"Urgent requirement for a leading construction and building material company,.
To handle routine Compliance work under GST.
Internal audits for policy adherence.","₹20,000 - ₹25,000 a month"
Senior Accountant,Eagle Coats Pvt Ltd,,"Overall responsibility of handling Accounts department of our organization.
Salary: From ₹40,000.00 per month.
Total work: 10 years (Preferred).","₹40,000 a month"
Sr. Accountant,Adwallz,," Prepare cash flow statement on daily basis for the current month.
 Prepare cash flow statement for the succeeding month on a monthly basis.","₹10,000 - ₹20,000 a month"
"Senior Accountant
new",Nazco Industries,,"We are looking for an Senior accountant.
Team player with ability to guide other accountants to prepare closing and E-filing of accounts.","₹20,000 - ₹30,000 a month"
"Senior Accountant
new",shreedham Builders,,"Accountable for preparation of books of accounts.
Supervising day to day accounting function.
Responsible for Finalization of Books of accounts, preparing data…","₹25,000 - ₹35,000 a month"
"Staff Accountant
new",Gama Control Services,,"Day to day account, know MS office, Tally ERP 9.
Job Types: Full-time, Regular / Permanent.
Pay: From ₹12,000.00 per month.","₹12,000 a month"
"Accounts Executive
new",PSA Chemicals,,"Com/any Post Graduate in accounts.
Experience Minimum 5 – 8 years relevant experience.
Salary As per industry norms.
Should be well versed with Tally 9.",
"Senior Accountant
new",Vidya Placement Service,,"Skills- We have requirement for Senior Accountant.
Must Have knowledge of GST, Sale purchase, TDS ,Bank reconciliation ,Balance sheet.","₹15,000 - ₹20,000 a month"
"Staff Accountant
new",Gama Control Services,,"Day to day account, know MS office, Tally ERP 9.
Job Types: Full-time, Regular / Permanent.
Pay: From ₹12,000.00 per month.","₹12,000 a month"
"Accounts Executive
new",PSA Chemicals,,"Com/any Post Graduate in accounts.
Experience Minimum 5 – 8 years relevant experience.
Salary As per industry norms.
Should be well versed with Tally 9.",
"Senior Accountant
new",Vidya Placement Service,,"Skills- We have requirement for Senior Accountant.
Must Have knowledge of GST, Sale purchase, TDS ,Bank reconciliation ,Balance sheet.","₹15,000 - ₹20,000 a month"
"Accountant
new",Armson Homes,,"You’ll be responsible for all daily accounting tasks, including preparing tax documents and updating expense files.
Analyze budgets and create expense reports.","₹15,000 - ₹20,000 a month"
"Finance Manager
new",Nitika Pharmaceutical Specialities Pvt. Ltd.,,"Oversee financial department employees, including financial assistants and accountants.
Monitor the day-to-day financial operations within the company, such as…","₹50,000 - ₹70,000 a month"
"Cost Accountant/ICWA
new",Paradise Placement Consultancy,,Job Description : Job Description: Hiring for Cost Accountant in India'sNo.1 Award winning company for pulp paper making machine & its spare parts to paper…,"₹5,50,000 a year"
"Consultant, Accountant, Project Associate, Block Coordinator...
new","Social Welfare Department, Assam",,"Date & venue of the interview through Email as mentioned in the Application Form.
Undersigned reserves the right to take decisions regarding the process of…",
"Senior Accountant
new",nash global overseas,,"Responsible for Maintaining Clients Accounts, Preparing Reports and Bills, Maintaining Sheets, Assist Team in Audit.
GST knowledge, Trained in Busy Software.","₹16,545 - ₹20,000 a month"
"Accountant
new",DXC Technology India,,Job Description : Job Description: Essential Job Functions * Leads and Support the month end processes * Review / approve journals and general ledger…,
Senior Accountant,Sri SCL Infratech Limited,,"Should have an idea about GST & TDS.
Should handle HR/Admin activities.
Experience into Construction field is an added advantage.
Job Types: Full-time, Walk-In.","₹30,000 - ₹35,000 a month"
"Accountant Cum Dispatch Manager
new",Burger Bae Clothing,,"Responsible for Stores activities e . g .
Will be responsible for the incoming material receipt, proper storage of material, material.","₹15,000 - ₹18,000 a month"
Senior Accountant,Sri Kumaran Super Market,,"Execute, monitor, maintain records & review the entire Key Accounts and follow up with all clients.
Reconciliation for Inter segmental accounts and Sales…","₹20,000 a month"
"Sr. Executive - Finance
new",CG Power Systems,,To look after the finance & account function of unit.,
"Junior Accountant
new",WSD Consultant,,"Provides Financial Information to Management By Researching and Analyzing Accounting Data; Preparing Reports.
Salary 1 Lac To 2 Lac P.A.","₹1,00,000 - ₹2,00,000 a year"
"accountant payable
new",Sankar Sealing Systems Pvt Ltd,,"Qualification : Bachelors or Master’s degree in commerce.
Experience : A minimum 4 years experience in Payables, bank payments and BRS. .","₹24,000 - ₹25,000 a month"
"accountant payable
new",Sankar Sealing Systems Pvt Ltd,,"Qualification : Bachelors or Master’s degree in commerce.
Experience : A minimum 4 years experience in Payables, bank payments and BRS. .","₹24,000 - ₹25,000 a month"
"Senior Accountant
new",Heritage Industries,,"We are looking for an experienced senior accountant who can help the management with monthly balance sheet, taxation, GST, cash flow statements, P/L statements,…","₹24,000 - ₹30,000 a month"
"Accountant
new",Talent Sense Global,,"Processing & Reconciling Bank statement and Credit card statement and comparing with past transactions for consistency.
Recording year end Journal entries.","₹4,00,000 - ₹6,00,000 a year"
"Sr. Accountant / Jr. Accountant
new",Squares N Spaces,,"Good knowledge in working Tally accounting package.
Keeping track of all payments and expenditure, purchase orders, invoices, statements (Accounts Payable).","₹15,000 - ₹45,000 a month"
"Accountant 4
new",Juniper Networks,,"We are seeking an enthusiastic accounting professional to be our Accountant 4 in the General Ledger Accounting team.
Key objectives for this position include:",
"Sr. Accountant
new",Krishna Electrovision Pvt Ltd,,"Verify, allocate, post and reconcile accounts payable and receivable.
Produce error-free accounting reports and present their results.","₹20,000 - ₹28,000 a month"
CHARTARED ACCOUNTANT,Adroit Group,,"Required Chartered Accountant for a Listed Company [ Turnover 100 Cr + ] in Udaipur ( Rajasthan ), Salary : 5 TO 10 LPA, www.adroitjobs.com, email : [email…","₹5,00,000 - ₹10,00,000 a year"
"Chartered Accountant : Ghaziabad
new",Ramon Lee,,"We are looking for fresher and immediate joiner Chartered Accountants.
Who are willing to work with the company for a longer tenure.","₹30,000 a month"
"Chartered Accountant
new",CLIENT OF JALANSH CONSULTANCY,,"RELEVANT EXPERIENCE 5-6 YEARS IN TAX PROFILE...
INCOME TAX,FEMA,MANGING AND ASSES,THE DIRECT TAX COMPLIANCE ON DELIVERABLES.
Application Deadline: 30/12/2020.","₹12,00,000 a year"
"Reporting Accountant Specialist
new",Kelly Services Internal,,The Reporting accountant will also provide support for statutory and tax compliance activities for the markets they are accountable and ensure that all R2R…,
"Assistant Accountant
new",Swipe Solutions & ICEICO TECHNOLOGIES PVT LTD,,"Qualification : 12th, any graduate, post graduate.
Interested candidate can call on: 9730739480.
Note: candidate call before visiting.","₹12,000 - ₹20,000 a month"
"Quickbooks Accountant | Bookkeeping
new",Place1India,,"Quickbooks Accountant Jobs in Ahmedabad, Gujarat.
Bookkeeping Accounting Job Vacancy in Ahmedabad.
Hiring for UK Quickbooks Accounts Executive in Ahmedabad.","₹30,000 a month"
Assistant Accountant,PHI Learning,,"Com Graduate candidates with strong computing skills specially in MS Excel, and good communication skills.
Facilitating internal payments (e.g., expense claims…",
"AP/Treasury Accountant
new",Smiths Detection,,"Minimum 6-7 years accounts payable experience or part qualified accountant.
The individual will be a key member of the Smiths Detection Global finance team.",
"Accounts Head/GM - Accounts, Accountant
new",Paradise Placement Consultancy,,Job Description : Job Description: * Excellent communication/presentation skills and ability to build relationships * Data preparing Annexure of Tax Audit like…,"₹3,60,000 a year"
"US Finance Support Executive (night Shift)
new",RWS Moravia,,"Excellent communication skills (Ability to converse with fund accountants to understand support needs).
We are looking for US Finance Support Professional for…","₹5,00,000 - ₹7,00,000 a year"
Finance Executive,SAGE Publications India Pvt. Ltd. Cookies Privacy...,,"Finance Executive role is part of the Global Services Finance Management Accounts team,.
Whose role is to support the US Finance team in promoting the success…",
Accountant,MBG Corporate Services,,"MBG Corporate Services is an independent and international organization which innovates and strategizes, to develop sustainable solutions with a professional…","₹25,000 - ₹30,000 a month"
Accountant for Construction Industry.,Vijaya Management Services,,"Must knowledge of ERP Highrise Software.
Salary 3 Lac To 5 Lac P.A.
Key Skills Tally GST Accountant Accounts Executive Accounts Assistant Finance Executive ERP…","₹3,00,000 - ₹5,00,000 a year"
Senior Accountant,Offers and Deals 365,,"Salary: * Depends on your performance at interview.
Should be able to prepare final accounts and financial statements.
Job Type: * On campus Job.","₹10,000 - ₹40,000 a month"
"ASSISTANT ACCOUNTANT FOR AN AUTOMOBILE SHOWROOM IN RANCHI, J...
new",TRUST US,,"A well established Two Wheeler dealer requires assistant accountant for its Ranchi branch.
The candidate should have minimum 1 year experience as junior…","₹15,000 - ₹18,000 a month"
"12th Pass Can Apply For Computer Operator Staff
new",Accounts Assistant and Computer Operator,,"Published on : 6 hours ago.
Understand the client requirement, review the source documents, update income transactions and enter the trade details.","₹17,000 - ₹22,500 a month"
Consultant,Deloitte,,"Audit is about much more than just the numbers.
It’s about attesting to accomplishments and challenges, and helping to assure strong foundations for future…",
"Accountant
new",HR Dynamics,,"Job opening for ""Senior and Junior Accountant"" - Mumbai.
We have opening for the both Positions.
Senior Accountant (M/F).
Junior Accountant cum Assistant (F).",
"Accountant
new",Edukosh Services Private Limited,,"To do all the accounts related activities in the office.
Expected Start Date: 4/1/2021.
Salary: ₹12,000.00 - ₹15,000.00 per month.","₹12,000 - ₹15,000 a month"
Senior Accountant,Whitefont Technologies,,"We are looking for experienced Accountant in our Company.
Job Location: Trichy/Chennai/Tirunelveli/Madurai/Karur/Salem.
Salary: From ₹25,000.00 per month.","₹25,000 a month"
Sr. Accountant,HGK Corp,,"Ensure business transactions are reported in accordance with generally accepted accounting principles.
Work closely with team members to assist with month-end…","₹35,000 - ₹45,000 a month"
Accountant,RISHABH MOTORS,,"Responsible for managing Dealer Finance & Cash Rotation.
Skills Required: Finance , Accounting Balance sheet Knowledge.
Pay: ₹18,937.00 - ₹45,385.00 per month.","₹18,937 - ₹45,385 a month"
Accountant,LCEPL,,"We are looking for an Accountant to manage all financial transactions, from fixed payments and variable expenses to bank deposits and budgets.",
"Senior Accountant
new",RC Technocrats,,"We are looking for Senior Accountant for Pune location having,.
\* Commerce Graduate with MIS & Tally is Mandatory,.
\* Salary - 7 to 8.4 LPA.","₹50,000 a month"
